url,title,comments,state,created_at,closed_athttps://api.github.com/repos/keras-team/keras/issues/15475,b'Using the same seed kwarg returns different values between GlorotUniform and GlorotUniformV2',"[b'@sachinprasadhs Was able to reproduce the issue on colab using `TF v2.6.0` ,Please find the gist [here](https://colab.research.google.com/gist/sushreebarsa/b14b4e3b9e46ac918dd4d367404a6de2/glorotuniforminitializationwithseedissue.ipynb) for reference.Thank you!', b'Is this the old https://stackoverflow.com/questions/61960609/why-is-rng-different-for-tensorflow-2-and-1 ?', b""This SO article (which I included in the gist) tells us that including the operation seed causes the backend to call a different RNG function.\r\n\r\nThe problem is that GlorotUniform generates totally different values between TF1 and TF2 versions, even when using the same global and operation seed. Even If the backend is different, the result should be the same if I set up the global and operation seeds in both cases.\r\n\r\nIf I'm migrating from TF1 and TF2, then this behavior is unexpected and might lead me to think that my migration went wrong."", b'Yes in TF2 `random_uniform` is conditional https://github.com/keras-team/keras/blob/5817ec5745a844a924065c19f4a9ee1cc4a5c66e/keras/backend.py#L1825-L1833\r\n\r\nYou can reproduce the same behavior in TF2 with `keras.backend.disable_generator_for_rng()`', b""@qlzh727 This symbol is not exported right? So isn't available in `tensorflow.keras` but only in `keras` right?"", b""Hi @fernandobperezm,\r\nThis is expected behavior for the initializers themselves. So it's not a bug in our view, esp. that the random seed in not part of the official public API. However, your use case is an important one and we'll look into providing a workaround.\r\n@tomerk, any thoughts on this? Is there a known work around or can we provide one to migration users?"", b""As I've mentioend `keras.backend.disable_generator_for_rng` is not part of the public API `from tensorflow import keras` but it is still part of `import keras`.\r\n\r\nBuf if we search in the source code it is not used anywhere."", b'The `disable_generator_for_rng ` is not intended for public API usage, and this is only a flag to hide the feature that is under development. We will try to turn on the feature when we are ready, and the flag is used for temp/debug usage at the moment.', b""`import keras` doesn't give you public API, it directly access the Keras package python code. User should always prefer `from tensorflow import keras`."", b'Yes but currently I think it is the only workaround that we have also if it is still not officially supported', b""Quick note: We're going to check the viability of including this in the migration correctness validation tooling that is already intended to aid migrating random number generation between tf1 and tf2:\r\nhttps://www.tensorflow.org/guide/migrate/validate_correctness"", b""Hi all, these week's I've been super busy and haven't had the time to see the updates on this issue.\r\n\r\n> Yes in TF2 `random_uniform` is conditional\r\n> \r\n> https://github.com/keras-team/keras/blob/5817ec5745a844a924065c19f4a9ee1cc4a5c66e/keras/backend.py#L1825-L1833\r\n> \r\n> You can reproduce the same behavior in TF2 with `keras.backend.disable_generator_for_rng()`\r\n\r\nThanks! I'll have a look at that. On the other hand, this made me think about a possible problem to solve, i.e., is there any way to make `tf.random.Generator.from_seed(...).uniform(...)` to return the same random numbers than `tf.random.uniform(...)`? Are the underlying algorithms different?\r\n\r\n> Hi @fernandobperezm,\r\n> This is expected behavior for the initializers themselves. So it's not a bug in our view, esp. that the random seed in not part of the official public API. However, your use case is an important one and we'll look into providing a workaround.\r\n> @tomerk, any thoughts on this? Is there a known work around or can we provide one to migration users?\r\n\r\nThanks for considering my use case. It seems a little odd that using random seeds is not part of the official public API of Keras when Tensorflow have them in their public API (I know that Keras is different than TF, but from the docs perspective they're are same). Is there any way I can help to provide a workaround?\r\n\r\n> Quick note: We're going to check the viability of including this in the migration correctness validation tooling that is already intended to aid migrating random number generation between tf1 and tf2:\r\n> https://www.tensorflow.org/guide/migrate/validate_correctness\r\n\r\nHow do you guys plan to include this in the migration tutorial? I may try the same steps if they do not involve using tf-nightly (sadly, I cannot use non-released TF versions in my pipeline).\r\n\r\n"", b""> Hi all, these week's I've been super busy and haven't had the time to see the updates on this issue.\r\n> \r\n> > Yes in TF2 `random_uniform` is conditional\r\n> > https://github.com/keras-team/keras/blob/5817ec5745a844a924065c19f4a9ee1cc4a5c66e/keras/backend.py#L1825-L1833\r\n> > \r\n> > You can reproduce the same behavior in TF2 with `keras.backend.disable_generator_for_rng()`\r\n> \r\n> Thanks! I'll have a look at that. On the other hand, this made me think about a possible problem to solve, i.e., is there any way to make `tf.random.Generator.from_seed(...).uniform(...)` to return the same random numbers than `tf.random.uniform(...)`? Are the underlying algorithms different?\r\n\r\nThe tf.random.Generator are using stateless ops, which is very different from tf.random.uniform. So it is not possible to produce same result with same seed.\r\n> \r\n> > Hi @fernandobperezm,\r\n> > This is expected behavior for the initializers themselves. So it's not a bug in our view, esp. that the random seed in not part of the official public API. However, your use case is an important one and we'll look into providing a workaround.\r\n> > @tomerk, any thoughts on this? Is there a known work around or can we provide one to migration users?\r\n> \r\n> Thanks for considering my use case. It seems a little odd that using random seeds is not part of the official public API of Keras when Tensorflow have them in their public API (I know that Keras is different than TF, but from the docs perspective they're are same). Is there any way I can help to provide a workaround?\r\n> \r\n> > Quick note: We're going to check the viability of including this in the migration correctness validation tooling that is already intended to aid migrating random number generation between tf1 and tf2:\r\n> > https://www.tensorflow.org/guide/migrate/validate_correctness\r\n> \r\n> How do you guys plan to include this in the migration tutorial? I may try the same steps if they do not involve using tf-nightly (sadly, I cannot use non-released TF versions in my pipeline).\r\n\r\nI will let @tomerk to comment more since we are working on some migration tool to help user have a fixed seed behavior.\r\n""]",open,2021-10-08 14:05:55,
https://api.github.com/repos/keras-team/keras/issues/15474,b'Reuse of layers with mixed precision produce multiple float16 copies of weights',"[b'@tringholm I tried to reproduce the issue on colab  using TF v2.6 ,Could Please find the [gist](https://colab.research.google.com/gist/sushreebarsa/68e000c8f52582cc78841f29206e9745/untitled455.ipynb) and confirm the issue reported here?Thank you!', b'The gist confirms the issue. With num_iterations=100 I get\r\n```\r\nResourceExhaustedError:  failed to allocate memory\r\n\t [[node gradient_tape/model_4/dense_4/MatMul_22/Cast/Cast (defined at <ipython-input-5-aa60ff95d6fb>:33) ]]\r\n```\r\n\r\nAlso, removing the need for casting the layer\'s variables by setting\r\n`dense_layer = Dense(layer_dim, dtype=tf.float16)`\r\nresolves the memory issue although it decreases the precision of the layer\'s stored variables, which is not the intent of mixed precision.\r\n\r\nA workaround that has helped for our (subclassed) layers is to keep a float32 master copy of weights, and then explicitly cast these before computations, something like this:\r\n\r\n```\r\nclass OuterLayer(tf.keras.layers.Layer):\r\n    def __init__(self, inner_size, loop_size):\r\n        self.inner_layer = InnerLayer(inner_size)\r\n        self.loop_size = loop_size\r\n\r\n    def __call__(self, inputs):\r\n        self.inner_layer.setup()\r\n        x = self.inner_layer(inputs)\r\n        for i in range(self.loop_size):\r\n            x = self.inner_layer(x)\r\n        return x\r\n\r\n\r\nclass InnerLayer(tf.keras.layers.Layer):\r\n    def __init__(self, size):\r\n        self.variable_master = self.add_weight(""variable"", shape=[size, size])\r\n        self.variable = None\r\n\r\n    def setup(self):\r\n        self.variable = tf.cast(self.variable_master, self.compute_dtype)\r\n\r\n    def call(self, inputs):\r\n        return tf.linalg.matmul(self.variable, inputs)\r\n```\r\n\r\nbut this is somewhat verbose and feels like it shouldn\'t be necessary. Perhaps the AutoCastVariable class could maintain the float16 copies?', b""I agree this is inconvenient, but unfortunately there's currently no solution currently to cache the casted value of AutoCastVariable. This is a tricky problem to solve, since a layer can modify the value of the weights in `call`, which would invalid the cached value if we did implement caching.\r\n\r\nAnother workaround for subclassed layers is to create the variable in `OuterLayer`, call `variable.read_value()` in `OuterLayer.call` (which causes the variable to be automatically casted), then pass the value to `InnerLayer.call`. This way the variable is read only once, so it is only casted once.\r\n\r\nFor some of the built-in RNN classes, the [variable is read outside the loop](https://github.com/keras-team/keras/blob/f5171d521acbf2ebbb6414352d5792163c41479f/keras/layers/recurrent_v2.py#L1194), so that the variable is casted only once per step instead of once per iteration of the RNN. For custom RNNs, currently you would need to implement that logic yourself to avoid creating many float16 copies of the variable.""]",open,2021-10-08 09:04:27,
https://api.github.com/repos/keras-team/keras/issues/15460,b'tf.keras.metrics.RootMeanSquaredError() not commutative for higher dimensional tensors',"[b""@MathiesW  I tried to run your code on colab using [2.5.0-gpu](https://colab.research.google.com/gist/sushreebarsa/064d13ca878c72688df36c9d872e1699/untitled439.ipynb) ,[2.6.0-gpu](https://colab.research.google.com/gist/sushreebarsa/88360ff0e1d87c157e8e807853ac02db/untitled438.ipynb#scrollTo=F0aPQV4yfg8q) and didn't face the issue reported here .Could you please have a look on the attached gists and let us know if it helps ? Thank you! "", b'@sushreebarsa thanks for the fast reply. Your attached gists work like a charm. This is interesting, I will have another look at my Python environment tomorrow.', b'Hi @sushreebarsa again! I managed to reproduce the error. Please take a look at my code on colab!\r\n[tf-2.6.0](https://colab.research.google.com/gist/MathiesW/5e7c7254806950dfb5b6abac71bbb47a/untitled438.ipynb)', b'@sachinprasadhs Was able to reproduce the issue on colab using TF-[2.6.0](https://colab.research.google.com/gist/sushreebarsa/71731375c309c9da08e5c726a773a15d/untitled441.ipynb) and [tf-nightly ](https://colab.research.google.com/gist/sushreebarsa/2e6a15e61346237d09e7dbc1c1b8306b/untitled442.ipynb),Please find the attached gists for reference.Thank you!']",open,2021-10-06 13:38:38,
https://api.github.com/repos/keras-team/keras/issues/15452,b'Support SPMD xla partitioning in TPUStrategyV2.',[],open,2021-10-04 18:43:05,
https://api.github.com/repos/keras-team/keras/issues/15451,b'Normalization layer masking',"[b'Hey there!  We are interested in this feature, please go ahead and prepare a pull request if you are willing!', b'I would like to work on this \r\n', b'Go for it! This fell on my back burner', b""Related if you're here looking for a different workaround: created this version that plays nicely with `tf.data.Dataset`: https://gist.github.com/kydonian/ddda453c8707cabb1eb9fbcbbd335ffa""]",open,2021-10-04 18:25:45,
https://api.github.com/repos/keras-team/keras/issues/15429,b'Updated image_dataset.py with `label_mode` is None and interpolation is `bilinear` it yields `uint8`.',"[b""@Saduf2019 Can you please check @fchollet's comments and keep us posted ? Thanks!""]",open,2021-09-29 18:22:59,
https://api.github.com/repos/keras-team/keras/issues/15425,b'Add layer trainable information in model summary and plot model',"[b""Thanks for the suggestion. We think this could be a useful feature, so please feel free to open a PR to add an optional `trainable` column to the summary (let's make it as narrow as possible since it's just a boolean flag)."", b'This could be closed as a patch implementing it was already merged.']",open,2021-09-28 11:33:14,
https://api.github.com/repos/keras-team/keras/issues/15420,b'[BUG] Omitting loss in model.compile will result in unhelpful error message',"[b'You are using one hot encoded vectors as the target variable, but in the loss function you are using ""binary crossentropy"", which is not correct rather you should use ""categorical cross entropy"", the loss obtained using ""binary crossentropy"" for this problem is wrong.\r\nKindly refer to this for more details :- https://stackoverflow.com/questions/42081257/why-binary-crossentropy-and-categorical-crossentropy-give-different-performances', b""@nilay121 The `loss` used here is tangential to the issue I reported, as I'm not reporting an issue with the convergence of some model. \r\n\r\nHowever, to answer your question, I am not using a one hot encoding, which you can verify with `y.sum(axis=1) == 1`. Thanks for bringing up as I noticed that I am using `softmax` instead of `sigmoid`, which I have corrected in the original post for correctness."", b'@xhlulu [#15441](https://github.com/keras-team/keras/pull/15441)']",open,2021-09-25 18:35:47,
https://api.github.com/repos/keras-team/keras/issues/15407,b'Collect slot variable restorations in a queue and restore them as a batch.',[],open,2021-09-22 18:53:27,
https://api.github.com/repos/keras-team/keras/issues/15392,"b'Validation is not run when using ""fit"" method if the validation set changes its size'","[b'@jvishnuvardhan  I could reproduce the issue with TF 2.6 and tf nightly .Please, find the gist [**`here`**](https://colab.research.google.com/gist/kumariko/2a002d5a04f0877a56074474ab36d4df/51241.ipynb#scrollTo=RSMnc5XAg9Ba).Thanks!']",open,2021-09-20 07:23:18,
https://api.github.com/repos/keras-team/keras/issues/15376,b'Copy variable for every step leads to slow training speed?',"[b'I think the copy-on-read is not suitable for larger variables, For larger variables, the performance of using shared locks will be better\xef\xbc\x9f', b'I was able to reproduce the issue. Please check the [gist here](https://colab.research.google.com/gist/jvishnuvardhan/63f9ed182854ad7732ca265cca5c0d2a/test.ipynb).\r\n\r\noutput from the code is as shown below\r\n\r\n### Training with Estimator\r\n\r\n```\r\nINFO:tensorflow:loss = 0.027672563, step = 50 (0.357 sec)\r\nINFO:tensorflow:global_step/sec: 25.7492\r\nINFO:tensorflow:loss = 0.025328398, step = 60 (0.389 sec)\r\nINFO:tensorflow:global_step/sec: 24.8684\r\nINFO:tensorflow:loss = 0.023781756, step = 70 (0.402 sec)\r\nINFO:tensorflow:global_step/sec: 24.6785\r\nINFO:tensorflow:loss = 0.022232072, step = 80 (0.408 sec)\r\nINFO:tensorflow:global_step/sec: 26.0616\r\nINFO:tensorflow:loss = 0.021159796, step = 90 (0.382 sec)\r\n```\r\n\r\n### Trainning with Keras\r\n`100/100 [==============================] - 81s 697ms/step - loss: 0.8490`\r\n\r\nAnalysis (As mentioned by @PWZER )\r\nWe can see the Keras trainning speed is 697ms/step, but the Estimator trainning speed is 38ms/step, About 20 times.']",open,2021-09-16 10:26:53,
https://api.github.com/repos/keras-team/keras/issues/15367,b'Rework the keras optimizer: define the structure of the new optimizer base class.',[],open,2021-09-14 23:22:21,
https://api.github.com/repos/keras-team/keras/issues/15365,b'Inverse kinematic approximation with neural network',[],open,2021-09-14 15:25:28,
https://api.github.com/repos/keras-team/keras/issues/15357,b'Cannot access y_true shape using a custom loss',"[b'Obviously, using tf.reshape with the y_true tensor inside my loss function is impossible : \r\n\r\n```\r\nValueError: in user code:\r\n\r\n    /home/valentin/anaconda3/lib/python3.8/site-packages/tensorflow/python/keras/engine/training.py:855 train_function  *\r\n        return step_function(self, iterator)\r\n    <ipython-input-13-b8bb8e39775a>:23 yoloLoss  *\r\n        inde_noobj = tf.cast(tf.ones(shape=inde_obj.shape, dtype=tf.float32) - inde_obj, dtype=tf.float32)\r\n    /home/valentin/anaconda3/lib/python3.8/site-packages/tensorflow/python/util/dispatch.py:206 wrapper  **\r\n        return target(*args, **kwargs)\r\n    /home/valentin/anaconda3/lib/python3.8/site-packages/tensorflow/python/ops/array_ops.py:3221 ones\r\n        shape = ops.convert_to_tensor(shape, dtype=dtypes.int32)\r\n    /home/valentin/anaconda3/lib/python3.8/site-packages/tensorflow/python/profiler/trace.py:163 wrapped\r\n        return func(*args, **kwargs)\r\n    /home/valentin/anaconda3/lib/python3.8/site-packages/tensorflow/python/framework/ops.py:1566 convert_to_tensor\r\n        ret = conversion_func(value, dtype=dtype, name=name, as_ref=as_ref)\r\n    /home/valentin/anaconda3/lib/python3.8/site-packages/tensorflow/python/framework/constant_op.py:355 _tensor_shape_tensor_conversion_function\r\n        raise ValueError(\r\n\r\n    ValueError: Cannot convert a partially known TensorShape to a Tensor: <unknown>\r\n\r\n```\r\n\r\n\r\n\r\n ', b'I tried to add a wrapper to my loss function as suggested in : https://stackoverflow.com/a/46465774/10819754\r\n\r\nI did this : \r\n```\r\n\r\nyolov1 = get_darknet_19(224,224, output_shape=OUTPUT_SHAPE[-1])\r\n\r\ninput_tensor = tf.keras.Input(shape=(224,224,3))\r\noutputs = yolov1(input_tensor)\r\nyolov1.compile(loss=custom_loss_wrapper(input_tensor), optimizer=""adam"")\r\n\r\nx = np.random.randn(64, 224, 224, 3) \r\ny = np.random.randn(64, 7, 7, 26)\r\n\r\nyolov1.test_on_batch(x,y)\r\n```\r\n\r\nAnd got the following desirable output : \r\n\r\n```\r\ny_true Tensor(""IteratorGetNext:1"", shape=(64, 7, 7, 26), dtype=float32)\r\ny_pred Tensor(""Yolo/conv2d_21/BiasAdd:0"", shape=(64, 7, 7, 31), dtype=float32)\r\n```\r\n\r\nTho, I suspect my problem to be related to my data pipeline, if anyone can confirm it, this would be awesome :]']",open,2021-09-13 08:11:31,
https://api.github.com/repos/keras-team/keras/issues/15351,"b""Keras Doesn't Use `KERAS_HOME` for Downloading Data on Windows""",[],open,2021-09-11 11:18:56,
