url,title,comments,state,created_at,closed_at
https://api.github.com/repos/keras-team/keras/issues/15986,b'Extra GPU-CPU memory transfer when broadcasting operations between integer tensors',[],open,2022-01-31 09:43:15,
https://api.github.com/repos/keras-team/keras/issues/15985,b'`image_dataset_from_directory()` should return both training and validation datasets',[],open,2022-01-31 09:14:48,
https://api.github.com/repos/keras-team/keras/issues/15984,b'Cannot add class weights for multilabel classification?',[],open,2022-01-31 07:29:00,
https://api.github.com/repos/keras-team/keras/issues/15983,b'Fix minor typo in Model.compile docstring',[],open,2022-01-31 01:16:02,
https://api.github.com/repos/keras-team/keras/issues/15982,"b'Rename ""premade"" (the meaning of which was ambiguous) to ""premade_models"" (clearer).'",[],open,2022-01-30 22:21:14,
https://api.github.com/repos/keras-team/keras/issues/15980,b'TimeDistributed(Flatten()) does not support masking',[],open,2022-01-30 20:53:58,
https://api.github.com/repos/keras-team/keras/issues/15979,b'Update metrics.py',[],open,2022-01-30 17:34:58,
https://api.github.com/repos/keras-team/keras/issues/15978,b'Silent swallowing of Exceptions thrown in `get_config` and potentially `from_config` / Documentation of SavedModel for custom Model',[],open,2022-01-30 08:19:25,
https://api.github.com/repos/keras-team/keras/issues/15977,b'Update callbacks.py',[],open,2022-01-29 07:35:20,
https://api.github.com/repos/keras-team/keras/issues/15976,b'How to create a dynamic embedding layer in keras ?',[],open,2022-01-29 06:55:28,
https://api.github.com/repos/keras-team/keras/issues/15975,b'Copy image utils from keras_preprocessing directly into core keras',[],open,2022-01-29 00:35:26,
https://api.github.com/repos/keras-team/keras/issues/15972,b'Feature/documentation request: re-add activation histograms or remove from docs',"[b'I can try to solve this', b'Hey @bersbersbers as far as I know you can visualize histograms in \r\ntensorboard by using tf.summary.histogram<br>Can you please attach your code so that I can see if we are on the same page?', b'@Cheril311 please see https://github.com/tensorflow/tensorflow/issues/42027#issuecomment-670719469. Keras writes weight histograms, but no activation histograms.', b'You seem to be right @bersbersbers , for now I have changed the documentation as I do know how to compute activation histograms but I am unaware on how to write them as tensorboard images', b'> I do know how to compute activation histograms but I am unaware on how to write them as tensorboard images\n\nI would think activation histograms can be written the same way as the weight histograms, at least in a first iteration. After all, both should have the exact same dimensions.', b'> > I do know how to compute activation histograms but I am unaware on how to write them as tensorboard images\r\n> \r\n> I would think activation histograms can be written the same way as the weight histograms, at least in a first iteration. After all, both should have the exact same dimensions.\r\n\r\nYup I agree with that but there is some other process done in the function  _log_weight_as_image in callbacks.py and I am not sure how to do the same for activations, if you can help me maybe we can submit a pr', b'> > I would think activation histograms can be written the same way as the weight histograms, at least in a first iteration. After all, both should have the exact same dimensions.\r\n> \r\n> Yup I agree with that but there is some other process done in the function _log_weight_as_image in callbacks.py and I am not sure how to do the same for activations, if you can help me maybe we can submit a pr\r\n\r\nTo my understanding, activations (for one sample) and weights have the same shape, so you can do exactly the same thing as here:\r\n\r\nhttps://github.com/keras-team/keras/blob/8015f697d0109ccd6021fe1b8f2bf5b133b259b9/keras/callbacks.py#L2570-L2580\r\n\r\nSince you mentioned in https://github.com/keras-team/keras/issues/15972#issuecomment-1024857466 that you know how to compute activation histograms (although I have yet to find a good solution myself, compare https://stackoverflow.com/q/60816678, https://gist.github.com/SiLiKhon/3965c967c3283feccc79822e6252b34c, https://stackoverflow.com/q/66779524), this should be straightforward then. Good luck!']",open,2022-01-28 14:20:40,
https://api.github.com/repos/keras-team/keras/issues/15967,b'RNN to model  lowpass filter',[],open,2022-01-27 18:47:05,
https://api.github.com/repos/keras-team/keras/issues/15964,b'LSTM model save warning',"[b""@StevenHuang2020 I was able to run the code successfully on colab using TF v2.7.0 and tf-nightly(2.9.0.dev20220126)  and didn't face the warning reported here.Could you please find the gist [here](https://colab.research.google.com/gist/sushreebarsa/997a7d67340735a857995fe3231a33f2/15964.ipynb#scrollTo=SH7P1z-zZVVr) and confirm the same?\r\nPlease provide the complete code and let us know if we are missing something to replicate the issue? Thanks!"", b'Here is my code.\r\nhttps://github.com/StevenHuang2020/COVID-19-Statistics/blob/e73c17cdc14ce38616164334dde3ed7c09543328/coronavirus/predictStatistics.py\r\n\r\nThe warning message is shown when model.save called after training\r\n\r\n![image](https://user-images.githubusercontent.com/61686583/151493297-229f2618-f805-4d4d-97f8-ccf864e7ac68.png)\r\n', b'I simplified it to 2 files, the dataset and py file.\r\n\r\ndataset link:\r\nhttps://raw.githubusercontent.com/owid/covid-19-data/master/public/data/owid-covid-data.csv\r\ntraining file:\r\n[predictStatistics.py.txt](https://github.com/keras-team/keras/files/7956105/predictStatistics.py.txt)\r\nYou can verify the above problem with this.\r\n', b'@jvishnuvardhan Was able to replicate the issue on colab using TF v2.7.0 , please find the gist [here ](https://colab.research.google.com/gist/sushreebarsa/001c1cfa939c1ae5e385c3f2c00ba072/keras15964.ipynb) for reference.Thanks!']",open,2022-01-27 11:21:38,
https://api.github.com/repos/keras-team/keras/issues/15958,b'Stop testing keras in the core tf docstest',[],open,2022-01-26 20:42:34,
https://api.github.com/repos/keras-team/keras/issues/15952,b'Support checkpointing ShardedVariables in optimizer slot variables.',[],open,2022-01-25 20:54:58,
https://api.github.com/repos/keras-team/keras/issues/15947,b'Fix tf.name_scope support for Keras nested layers.',[],open,2022-01-25 09:08:20,
https://api.github.com/repos/keras-team/keras/issues/15941,b'mode.predict freezes',[b'@shubham9630 Can you please share a simple standalone code to reproduce the issue? Thanks!'],open,2022-01-23 20:37:31,
https://api.github.com/repos/keras-team/keras/issues/15940,b'The model saving is disturbed by the error raised intentionaly.',"[b""@realmadridmarcelo I am not able to reproduce the issue. When I ran your code, I was able to save the model in `h5` format but couldn't load it. Please check the [gist here](https://colab.research.google.com/gist/jvishnuvardhan/f53d38e7cc05c9fef9a505aa5aaecd7e/untitled1145.ipynb). Thanks!\r\n\r\nPlease check whether I made any mistake. Thanks!"", b'Thank you for your examination!\r\nYour code and mine are almost the same.\r\nOnly one difference is the python version. (My env: 3.8.12, Your env: 3.7)\r\nBut I think that it is not essential for this issue.']",open,2022-01-23 11:26:02,
https://api.github.com/repos/keras-team/keras/issues/15939,b'Shape issues in tf.keras.metrics.SparseTopKCategoricalAccuracy with multiple dimensions',"[b'This is indeed a surprising behavior -- it seems the format expectation for the `sample_weight` argument is different in the case of the `SparseTopKCategoricalAccuracy` in this case. Would you like to open a PR with a fix?', b""Sure I'll have a look. I'll also double-check if this happens for the others in 'metrics' to see if they fail in a similar manner."", b'Thank you!']",open,2022-01-23 04:48:16,
https://api.github.com/repos/keras-team/keras/issues/15936,"b'TensorFlow ""TypeError: Target data is missing"" though dataset with 2 dimension tuple was supplied'","[b'Can you provide a code example where I can run your code to replicate the issue', b'Here is the full code of the file:\r\n\r\n```\r\nfrom datetime import datetime\r\n\r\nfrom keras import layers\r\nfrom keras.layers import Reshape\r\nfrom numpy import loadtxt\r\nimport tensorflow_addons as tfa\r\nimport numpy as np\r\nimport sys\r\n\r\nsys.path.append(""./transformer/models/official/vision/beta/projects/vit/modeling/"")\r\nsys.path.append(""./transformer/models"")\r\n\r\nfrom tensorflow.keras.models import Sequential\r\nfrom tensorflow.keras.layers import Dense\r\nfrom tensorflow.keras import regularizers\r\nimport tensorflow as tf\r\nfrom vit import VisionTransformer\r\nfrom tensorflow.keras import mixed_precision\r\npolicy = mixed_precision.Policy(\'mixed_float16\')\r\nmixed_precision.set_global_policy(policy)\r\n\r\nREGULARIZATION = 1e-10\r\nBIAS_REGULARIZATION = 1e-8\r\nDATASET_SPLIT_PERCENTAGE = 1\r\nprint(""Num GPUs Available: "", len(tf.config.list_physical_devices(\'GPU\')))\r\n#load csv file data\r\nimport csv\r\nwith open(\'/sda/Eran/imagenet-in-np/all-imagenet-images.csv\', \'r\') as csvfile:\r\n    reader = csv.reader(csvfile, delimiter=\',\')\r\n    feature = list(reader)\r\ndef convert_token_list_to_id_list(token_list):\r\n    \'\'\'\r\n    given list of one cell list of tokens, assign each token a unique id, and then replaces each instance of the token with the matched id\r\n    returns the original list of token by the original order, with each token replaced by id\r\n    \'\'\'\r\n    token_list = [item for sublist in token_list for item in sublist]\r\n    unique_tokens = list(set(token_list))\r\n    token_to_id_dict = dict(zip(unique_tokens, range(len(unique_tokens))))\r\n    id_list = [token_to_id_dict[token] for token in token_list]\r\n    return id_list\r\ndef numpy_one_hot_vector(id_list, num_classes):\r\n    \'\'\'\r\n    given a list of ids, return a numpy array of one-hot vectors\r\n    \'\'\'\r\n    num_classes+=1\r\n    one_hot_vector_list = np.zeros((len(id_list), num_classes), dtype=np.float32)\r\n    one_hot_vector_list[np.arange(len(id_list)), id_list] = 1\r\n    return one_hot_vector_list\r\n\r\nfeature=convert_token_list_to_id_list(feature)\r\nfeature=numpy_one_hot_vector(feature,1000)\r\nsamples=np.load(""/sda/Eran/imagenet-in-np/extracted-wavelet-of-all-imagenet.npy"").T\r\nNUM_OF_SAMPLES = samples.shape[0]\r\nBLOCK_DIMENSION = [NUM_OF_SAMPLES, 16, 17, 10]\r\n\r\nmean = (samples.mean(axis=0))\r\nstd=(samples.std(axis=0))\r\nmean=mean.T\r\nstd=std.T\r\nepsilon=np.finfo(float).tiny\r\nsamples=((samples - mean)/(std+epsilon))\r\n\r\n\r\n###\r\n#@todo change the shape to something meaningfull\r\nsamples=np.reshape(samples, BLOCK_DIMENSION)\r\n# define the keras model\r\nmodel=Sequential()\r\nmodel.add(VisionTransformer(input_specs=layers.InputSpec(shape=BLOCK_DIMENSION)))\r\nmodel.add(Dense(1000,activation=""softmax""))\r\nmodel.add(Reshape([ 1000]))\r\n# compile the keras model\r\nmodel.compile(loss=""BinaryCrossentropy"", optimizer=tfa.optimizers.LAMB(),\r\n              metrics=[tf.keras.metrics.Precision(), tf.keras.metrics.Recall(), tf.keras.metrics.AUC()]\r\n              )\r\n\r\nlog_dir = ""/home/eran/logs/"" + datetime.now().strftime(""%Y%m%d-%H%M%S"")\r\ntensorboard_callback = tf.keras.callbacks.TensorBoard(log_dir=log_dir, histogram_freq=1)\r\nprint(model.summary())\r\n\r\ndef gen():\r\n    for element in zip(samples,feature):\r\n        yield element\r\nds = tf.data.Dataset.from_generator(gen,output_types=tf.dtypes.float32)\r\n\r\n\r\n\r\nmodel.fit(ds,\r\n          epochs=150,\r\n          #callbacks=[tensorboard_callback]\r\n          )\r\nmodel.save(""/sda/Eran/imagenet-in-np/transformer"")\r\n\r\npass\r\n```', b'Can you also provide the data files you are using or maybe preferably generate random data in the code so that I can run your code. Also provide the version of packages you are using ', b'@exx8 Can you please share a simple standalone code to reproduce the issue? Looks like the issue is more related to data generator, so use some simple model with a data generator (of random data). Thanks!']",open,2022-01-21 17:09:03,
https://api.github.com/repos/keras-team/keras/issues/15933,b'Higher validation and test loss and lower accuracy using tf.data.dataset with tfrecords than using numpy',[],open,2022-01-21 11:46:59,
https://api.github.com/repos/keras-team/keras/issues/15931,"b""Using learning-rate decay schedule with Keras (transfer learning with RESNET) generates unsupported operand error 'ExponentialDecay'""",[b'@castorgit this problem appears to be fixed in the latest TF-nightly version. See here https://colab.research.google.com/gist/amahendrakar/697836288a6d02f048d11e08b7044079/41639-tf-nightly.ipynb'],open,2022-01-21 07:21:09,
https://api.github.com/repos/keras-team/keras/issues/15925,"b""Use fully qualified name in keras.utils.custom_object_scope's docstring.""",[],open,2022-01-20 16:54:58,
https://api.github.com/repos/keras-team/keras/issues/15917,b'Loading optimizer state without using model.compile',"[b'@ttdd11 It looks like this is more related to `TPU distribution strategy`.  Can you open this issue on Tensorflow where I can triage it to TPU team? Thanks!', b""@jvishnuvardhan I did a few days ago, sorry that I didn't mention it here: https://github.com/tensorflow/tensorflow/issues/53844 , still waiting to hear back. Any added visibility would be greatly appreciated, as all of our compute experiments are currently on hold. ""]",open,2022-01-19 14:22:44,
https://api.github.com/repos/keras-team/keras/issues/15916,b'DeeplabV3+ Training on custom dataset',"[b'@parth29-vc \r\nIn order to reproduce the issue reported here, could you please provide the standalone code and the dataset ? Thanks!']",open,2022-01-19 06:01:06,
https://api.github.com/repos/keras-team/keras/issues/15915,b'BUG when converting from pytorch GRU model to Keras GRU model',[],open,2022-01-19 03:11:37,
https://api.github.com/repos/keras-team/keras/issues/15912,"b'keras.layers.SimpleRNN/LSTM output NaN when setting ""activation"" to ""exponential""'","[b""Hey, I think Pytorch does not have any 'exponential' activation function, so when your code is being converted using onnx do you know which pytorch activation function is being used"", b""> Hey, I think Pytorch does not have any 'exponential' activation function, so when your code is being converted using onnx do you know which pytorch activation function is being used\r\n\r\nYes, following the implementation of onnx2pytorch, the exponential activation will be converted to `torch.exp`.\r\nhttps://github.com/ToriML/onnx2pytorch/blob/89a3fe7b208952760138c550c499fe9c57c35d45/onnx2pytorch/convert/operations.py#L115\r\n\r\nApart from this, may I know that SimpleRNN/LSTM output NaN when setting activation as `Exponential` is the expected behavior?\r\n"", b'I think this is because of the **exploding gradients** problem as the gradients are increasing exponentially in your case. As technically you get NaNs when you perform computations that dont make sense, for example _inf-inf_. However I am not sure if getting those NaNs in your case is expected in place of Infs. I think Stack Overflow will be a better place to ask this.']",open,2022-01-17 08:42:11,
https://api.github.com/repos/keras-team/keras/issues/15911,b'drop_connect_rate in efficientnet is not documented',[],open,2022-01-15 23:23:54,
https://api.github.com/repos/keras-team/keras/issues/15909,b'Regularization Loss is getting added twice if model is encapsulated in another model',"[b'@sachinprasadhs Was able to reproduce the issue in TF v2.7 please find the gist [here](https://colab.research.google.com/gist/kumariko/a7d76966c629ffeb6fcc06fed0af8ddc/keras-regularizer-issue.ipynb#scrollTo=ABp9hJnVTxjr). Thanks!', b'Triage notes: we had similar bug before, and should look into the root cause for this.']",open,2022-01-15 15:26:04,
https://api.github.com/repos/keras-team/keras/issues/15900,b'The keras.layers.CategoricalEncoding layer removes batch dimension for single-element batches.',"[b'@jvishnuvardhan ,\r\nI was able to reproduce the issue in v2.7 and nightly.Please find the gist of it [here](https://colab.research.google.com/gist/tilakrayal/6451be832f2bcc872d06898773b276e2/categoryencoding.ipynb).']",open,2022-01-13 23:40:05,
https://api.github.com/repos/keras-team/keras/issues/15897,b'How to make Keras Layer class to be immutable or is this a bug?',"[b'@quaesitor-scientiam In order to expedite the trouble-shooting process, please provide a code snippet to reproduce the issue reported here. Thanks!']",open,2022-01-13 11:46:43,
https://api.github.com/repos/keras-team/keras/issues/15896,b'The GRU/LSTM function bugs when using TF2.7',"[b'@hayatejp ,\r\nPlease take a look at this SO [link](https://stackoverflow.com/questions/48851558/tensorflow-estimator-valueerror-logits-and-labels-must-have-the-same-shape) and [issue](https://github.com/tensorflow/tensorflow/issues/42824) with the similar error.It helps.Thanks!', b'This issue has been automatically marked as stale because it has no recent activity. It will be closed if no further activity occurs. Thank you.\n']",open,2022-01-13 05:43:28,
https://api.github.com/repos/keras-team/keras/issues/15895,b'Regarding documentation for RegNets',"[b'Triage notes: We should provide a user accessible way to produce performance benchmarks. Or we need to at least have it available internally to produce the number for user.', b'I think it might be useful to put up a guide for benchmarks for contributors. ', b'Thanks @sayakpaul. Please feel free to write up a guide for how to setup this env. \r\n\r\nOn a side note, we are going to explore a setup for keras cv and nlp to benchmark the performance for applications.', b'I think the Keras team should write to reduce the chances of errors, inconsistencies, etc. \r\n\r\nBut if you could share some references on how the team usually goes about it, I can take a dig. \r\n\r\nFor benchmarking performance (not the throughput, just accuracy), I usually do something like this:\r\n\r\nhttps://github.com/sayakpaul/ViT-jax2tf/tree/main/i1k_eval. ']",open,2022-01-13 04:58:34,
https://api.github.com/repos/keras-team/keras/issues/15892,b'use tf.io.gfile instead of os.path to support cloud paths.',[],open,2022-01-12 07:18:22,
https://api.github.com/repos/keras-team/keras/issues/15887,b'High memory consumption with model.fit in TF 2.x',"[b'Than you very much for doing this. Let me post also the slightly modified test code with built-in memory measurements, which may be more convenient:\r\n\r\n```python\r\nimport tensorflow as tf\r\nimport numpy as np\r\nimport psutil\r\nimport os\r\n\r\nfrom tensorflow.keras.models import Model\r\nfrom tensorflow.keras.layers import Input, Lambda, Conv2D\r\nfrom tensorflow.keras.callbacks import Callback\r\n\r\nprint(""Tensorflow version: {}"".format(tf.__version__),flush=True)\r\n\r\nK = 5000 # Number of images\r\nN = 512  # Image size\r\n\r\nMAX_SIGNAL = 5000 # The values of the training data range from 0 to this\r\n\r\nclass MemoryUsageCallback(Callback):\r\n  \'\'\'Monitor memory usage on epoch begin and end.\'\'\'\r\n\r\n  def on_epoch_begin(self,epoch,logs=None):\r\n    print(\'**Epoch {}**\'.format(epoch))\r\n    print(\'Memory usage on epoch begin: {}\'.format(psutil.Process(os.getpid()).memory_info().rss))\r\n\r\n  def on_epoch_end(self,epoch,logs=None):\r\n    print(\'Memory usage on epoch end:   {}\'.format(psutil.Process(os.getpid()).memory_info().rss))\r\n    \r\ndef build_model():\r\n  \'\'\'Create a simple test model.\'\'\'\r\n  \r\n  inputs = Input((N,N,1))\r\n  s = Lambda(lambda x: x / MAX_SIGNAL) (inputs)\r\n  s = Conv2D(1, (3, 3), activation=\'sigmoid\', padding=\'same\')(s)\r\n  outputs = s\r\n\r\n  return Model(inputs=[inputs], outputs=[outputs])\r\n\r\n# Generate some random data\r\nx_train = np.random.randint(MAX_SIGNAL+1,size=(K,N,N,1),dtype=np.uint16) # Should be 2 560 000 kB\r\ny_train = np.random.randint(1+1         ,size=(K,N,N,1),dtype=np.bool)   # Should be 1 280 000 kB\r\nx_val   = np.random.randint(MAX_SIGNAL+1,size=(K,N,N,1),dtype=np.uint16) # Should be 2 560 000 kB\r\ny_val   = np.random.randint(1+1         ,size=(K,N,N,1),dtype=np.bool)   # Should be 1 280 000 kB\r\n# In total, the above arrays should be 7 680 000 kB\r\n\r\nmodel = build_model()\r\n\r\ncallbacks = [MemoryUsageCallback()]\r\noptimizer = tf.keras.optimizers.Adam()\r\nloss = tf.keras.losses.BinaryCrossentropy()\r\n\r\nmodel.compile(optimizer=optimizer, loss=loss)\r\nmodel.fit(x=x_train, y=y_train, validation_data=(x_val,y_val), batch_size=8, epochs=10, callbacks=callbacks, verbose=0)\r\n```\r\n\r\nThe above is meant to reproduce the issue with data passed to `model.fit` as numpy arrays. To test the behavior with TF datasets, replace the last line with the following:\r\n\r\n```python\r\nds_train = tf.data.Dataset.from_tensor_slices((x_train,y_train)).batch(8)\r\nds_val = tf.data.Dataset.from_tensor_slices((x_val,y_val)).batch(8)\r\nmodel.fit(ds_train, validation_data=ds_val, batch_size=8, epochs=10, callbacks=callbacks, verbose=0)\r\n```', b'Also, anybody investigating the root of the problem, be sure to note the issue tensorflow/tensorflow#35030, where @mihaimaruseac has tracked the point at which the bug has been introduced.', b'Triage notes: This is a long stand performance issue, and we should have someone look into this.', b""Hello @gdudziuk, it'd be helpful if you could help us with the following,\r\n\r\n- Is this a regression from any previous TF versions?\r\n- If you construct a custom training loop that achieves the same thing as this `Model.fit`, are you seeing smaller memory usage?\r\n\r\nThanks!""]",open,2022-01-11 04:35:32,
https://api.github.com/repos/keras-team/keras/issues/15881,b'test_activity_regularizer_batch_independent_v2_eager  and test_activity_regularizer_batch_independent_v2_function fail on aarch64',"[b'@ggardet ,\r\nIn order to expedite the trouble-shooting process, could you please provide the complete code and dataset to reproduce the issue reported here.', b'This issue has been automatically marked as stale because it has no recent activity. It will be closed if no further activity occurs. Thank you.\n', b'> \r\n\r\nWe just run:\r\n```\r\nfor f in keras/tests/*_test.py; do\r\n  # ValueError: Please provide a TPU Name to connect to.\r\n  [ ""$f"" = ""keras/tests/automatic_outside_compilation_test.py"" ] && continue || :\r\n  # import error: test file not installed into sitelib\r\n  [ ""$f"" = ""keras/tests/get_config_test.py"" ] && continue || :\r\n  # no tensorflow.compiler.tests\r\n  [ ""$f"" = ""keras/tests/tracking_util_xla_test.py"" ] && continue || :\r\n  # Note: These might be genuine errors, but in order to get it checked in, we rather ignore them now.\r\n  #       It is still better than not running any tests at all.\r\n  $python $f\r\ndone\r\n```\r\nWith `$python` being the current python interpreter.']",open,2022-01-10 13:20:05,
https://api.github.com/repos/keras-team/keras/issues/15863,b'Support relative (in addition to absolute) `min_delta` parameters in `keras.callbacks.ReduceLROnPlateau`',"[b'@rchao Rick, could you take a closer look? Thanks!']",open,2022-01-06 04:30:35,
https://api.github.com/repos/keras-team/keras/issues/15858,b'Error in build. ',"[b""Sadly we usually just verify our build process on Linux, and current we don't have a windows OSS build. Will discuss this on the triage meeting."", b""@old-school-kid \r\n\r\nNot sure, but I think you can try one of the following:\r\n- Docker: use a docker container if possible, it'll make things much simpler.\r\n- In your particular case, restarting the computer might help. In my case proto related errors disappeared after restarting. Also, don't forget to add bazel to `PATH`."", b'Thanks @AdityaKane2001  for the reply. @old-school-kid could u check if this error is caused by any local env issue?', b""> In your particular case, restarting the computer might help. In my case proto related errors disappeared after restarting. Also, don't forget to add bazel to PATH.\r\n\r\nTests start and actually first 106 out of 165 of them pass too. So I dont think there is an issue with local env. And I restarted my computer but didn't help. \r\n\r\n> Docker: use a docker container if possible, it'll make things much simpler.\r\n\r\nWill try to do this but isn't it supposed to build locally in a Windows machine."", b""> Will try to do this but isn't it supposed to build locally in a Windows machine.\r\n\r\nThings are not really supported well on Windows. Hence the recommendation. ""]",open,2022-01-05 17:51:08,
