url,title,comments,state,created_at,closed_athttps://api.github.com/repos/keras-team/keras/issues/15698,b'tensorflow/core/util/gpu_launch_config.h:129] Check failed: work_element_count > 0 (-1018167296 vs. 0)',"[b""Update: I downgraded the Amazon Linux instance to Cuda 10.2 and Tensorflow 2.3 and still have the same problem. I had seen in the release notes that Cuda 10.2 had fixed an issue with very large batches and mixed precision, but it doesn't fix this.\r\n"", b'@sanatmpa1,\r\n\r\nCan you please take a look at the [tested build configurations](https://www.tensorflow.org/install/source#gpu) which shows the corresponding `CUDA` version for each version of `Tensorflow`. Also please share the fully reproducible stand alone code to expedite the trouble shooting process. Thanks!', b'Tested with with following configurations on Windows 10 and AWS Linux (RHEL7) with hardware as described above:\r\nTensorflow 2.60\r\nPython 3.8.5\r\nCuDNN: 8.1\r\nCuda 11.2\r\nPip: 20.2.4\r\n\r\nFull source not available, relevant source:\r\n    def create_generator(self):\r\n        self.logger.debug(\'called\')\r\n\r\n        inputs = tf.keras.Input(shape=(self._noise_dim,))\r\n        dense = Dense(128 * self.dim * self.dim,\r\n                      kernel_initializer=tf.keras.initializers.RandomNormal(stddev=0.02))\r\n        x = dense(inputs)\r\n        x = BatchNormalization(momentum=0.8)(x)\r\n        x = LeakyReLU(0.2)(x)\r\n        x = Reshape((self.dim, self.dim, 128))(x)\r\n        x = UpSampling2D(size=(self.upSamp, self.upSamp))(x)\r\n        x = Conv2D(64, kernel_size=(5, 5), padding=\'same\')(x)\r\n        x = BatchNormalization(momentum=0.8)(x)\r\n        x = LeakyReLU(0.2)(x)\r\n        x = UpSampling2D(size=(self.upSamp, self.upSamp))(x)\r\n        x = Conv2D(1, kernel_size=(5, 5), padding=\'same\')(x)\r\n        x = BatchNormalization(momentum=0.8)(x)\r\n        x = Flatten()(x)\r\n        outputs = Dense(self.feature_size, activation=\'tanh\', dtype=np.float32)(x)  # All output between -1 and 1\r\n\r\n        generator = tf.keras.Model(inputs=inputs, outputs=outputs, name=\'Generator\')\r\n        generator.compile(loss=self.generator_loss_function, optimizer=self.generator_optimizer)\r\n\r\n        return generator\r\n\r\n    def create_discriminator(self):\r\n        self.logger.debug(\'called\')\r\n\r\n        inputs = tf.keras.Input(shape=(self.feature_size,))\r\n        dense = Dense(self.dim * self.dim * 32, input_shape=(self.feature_size,),\r\n                                kernel_initializer=tf.keras.initializers.RandomNormal(stddev=0.02))\r\n        x = dense(inputs)\r\n        x = Reshape((self.dim, self.dim, 32))(x)\r\n        # x = Conv2D(128, kernel_size=(5, 5), strides=(2, 2), padding=\'same\')(x)\r\n        # x = BatchNormalization(momentum=0.8)(x)\r\n        # x = LeakyReLU(0.2)(x)\r\n        # x = Dropout(rate=0.3)(x)\r\n\r\n        x = Conv2D(64, kernel_size=(5, 5), strides=(2, 2), padding=\'same\')(x)\r\n        # discriminator.add(BatchNormalization(momentum=0.8)(x)\r\n        x = LeakyReLU(0.2)(x)\r\n        x = Dropout(rate=0.25)(x)\r\n\r\n        x = Conv2D(64, kernel_size=(5, 5), strides=(2, 2), padding=\'same\')(x)\r\n        # x = BatchNormalization(momentum=0.8)(x)\r\n        x = LeakyReLU(0.2)(x)\r\n        x = Dropout(rate=0.25)(x)\r\n\r\n        x = Flatten()(x)\r\n        outputs = Dense(1, activation=\'sigmoid\', dtype=np.float32)(x)  # Original + dtype for mixed-precision\r\n        # x= Dense(1)(x) # https://medium.com/swlh/gan-generative-adversarial-network-3706ebfef77e\r\n\r\n        discriminator = tf.keras.Model(inputs = inputs, outputs=outputs, name=\'Discriminator\')\r\n        discriminator.compile(loss=self.discriminator_loss_function,\r\n                              optimizer=self.discriminator_optimizer, metrics=[\'accuracy\'])\r\n\r\n        return discriminator\r\n\r\n    def discriminator_loss(self, real_output, synthetic_output):\r\n        # https://stackoverflow.com/questions/55936611/why-doesnt-the-discriminators-and-generators-loss-change\r\n        cross_entropy = tf.keras.losses.BinaryCrossentropy()\r\n        real_loss = cross_entropy(tf.ones_like(real_output), real_output)\r\n        fake_loss = cross_entropy(tf.zeros_like(synthetic_output), synthetic_output)\r\n        total_loss = (real_loss + fake_loss) / 2\r\n\r\n        return total_loss\r\n\r\n    def generator_loss(self, fake_output) -> object:\r\n        # https://stackoverflow.com/questions/55936611/why-doesnt-the-discriminators-and-generators-loss-change\r\n        cross_entropy = tf.keras.losses.BinaryCrossentropy()\r\n        gen_loss = cross_entropy(tf.ones_like(fake_output), fake_output)\r\n\r\n        return gen_loss\r\n\r\n    # Notice the use of `tf.function`. This annotation causes the function to be ""compiled"".\r\n    @tf.function()\r\n    def _train_gen(self, real_data):\r\n        #self.logger.info(\'Called\')\r\n        noise = tf.random.normal([self._batch_size, self._noise_dim])\r\n\r\n        with tf.GradientTape() as gen_tape, tf.GradientTape() as _:\r\n            # Generator creates synthetic _data\r\n            synthetic_data = self._generator(noise, training=True)\r\n            # Discriminator predicts on real _data\r\n            real_data_pred = self._discriminator(real_data, training=False)\r\n            # Discriminator predicts on synthetic _data\r\n            synth_data_pred = self._discriminator(synthetic_data, training=False)\r\n            # Calculate Generator loss based on Discriminator\'s predictions of synthetic _data\r\n            gen_loss = self.generator_loss(synth_data_pred)\r\n            # Calculate Discriminator loss based on Discriminator\'s predictions of real and synthetic _data\r\n            disc_loss = self.discriminator_loss(real_data_pred, synth_data_pred)\r\n\r\n        gradients_of_generator = gen_tape.gradient(gen_loss, self._generator.trainable_variables)\r\n        self.generator_optimizer.apply_gradients(zip(gradients_of_generator, self._generator.trainable_variables))\r\n\r\n        return gen_loss, disc_loss\r\n\r\n    # Notice the use of `tf.function`. This annotation causes the function to be ""compiled"".\r\n    @tf.function()\r\n    def _train_step(self, real_data):\r\n        #self.logger.info(\'Called\')\r\n        noise = tf.random.normal([self._batch_size, self._noise_dim])\r\n\r\n        with tf.GradientTape() as gen_tape, tf.GradientTape() as disc_tape:\r\n            # Generator creates synthetic _data\r\n            synthetic_data = self._generator(noise, training=True)\r\n            # Discriminator predicts on real _data\r\n            real_data_pred = self._discriminator(real_data, training=True)\r\n            # Discriminator predicts on synthetic _data\r\n            synth_data_pred = self._discriminator(synthetic_data, training=True)\r\n            # Calculate Generator loss based on Discriminator\'s predictions of synthetic _data\r\n            gen_loss = self.generator_loss(synth_data_pred)\r\n            # Calculate Discriminator loss based on Discriminator\'s predictions of real and synthetic _data\r\n            disc_loss = self.discriminator_loss(real_data_pred, synth_data_pred)\r\n\r\n        gradients_of_generator = gen_tape.gradient(gen_loss, self._generator.trainable_variables)\r\n        gradients_of_discriminator = disc_tape.gradient(disc_loss, self._discriminator.trainable_variables)\r\n        self.generator_optimizer.apply_gradients(zip(gradients_of_generator, self._generator.trainable_variables))\r\n        self.discriminator_optimizer.apply_gradients(zip(gradients_of_discriminator,\r\n                                                         self._discriminator.trainable_variables))\r\n\r\n        return gen_loss, disc_loss\r\n\r\n    def train(self, job: Job, epochs=None) -> None:\r\n        self.job = job;\r\n        start = time.time()\r\n        update_time = start + 60*5  # 5 minutes\r\n        if epochs is None:\r\n            epochs = job.db_job.epochs\r\n        update_calc = lambda x: int(epochs / 10) if (int(epochs / 10) > 0) else 1\r\n        update_rate = update_calc(epochs)\r\n        # assert not np.any(np.isnan(data.normalized.values))\r\n        self._batch_size = self._round_batch_size(job.db_job.batch_size)\r\n        if len(self.data.normalized) < self._batch_size:\r\n            self._batch_size = self._round_batch_size(len(self.data.normalized))\r\n            self.logger.info(f\'Specified batch_size greater than sample size: changing to {self._batch_size}\')\r\n        self.logger.debug(f\'Starting training of {epochs} epochs with batch size of {self._batch_size}\')\r\n        self.logger.info(f\'data.normalized.shape[0] = {self.data.normalized.shape[0]}\')\r\n        num_batches = int(len(self.data.normalized) / self._batch_size)\r\n        gen_count = 0\r\n        dis_count = 0\r\n        disc_loss = 0.0\r\n        gen_loss = 0.0\r\n\r\n        for epoch in range(epochs):\r\n            for batch_num in range(num_batches):  # Train on all data in each epoch\r\n                # indexes = randint(0, self.data.normalized.shape[0], batch_size)  # Generate non-contiguous random indexes\r\n                if self._batch_size > self.data.normalized.shape[0]:\r\n                    index = randint(0, self.data.normalized.shape[0] - self._batch_size)  # Generate contiguous random indexes\r\n                else:\r\n                    index = 0\r\n                real_data = self.data.normalized.values[index: index+self._batch_size]\r\n                # self.logger.debug(f\'Batch: {batch_num*batch_size} : {(batch_num*batch_size + batch_size)}\')\r\n                gen_loss, disc_loss = self._train_step(real_data)\r\n                # else:\r\n                #     if balance and gen_loss > disc_loss:  # Train just gen\r\n                #         gen_loss, disc_loss = self._train_gen(real_data)\r\n                #         gen_count += 1\r\n                #     else:  # Train both again\r\n                #         gen_loss, disc_loss = self._train_step(real_data)\r\n                #         dis_count += 1\r\n            # Save the model every periodically\r\n            if epoch % update_rate == 0 or time.time() > update_time:\r\n                # etime = (time.time() - start)\r\n                update_time = time.time() + 5 * 60  # 5 minutes\r\n                self.logger.debug(f\'Epoch: {epoch}   \\tgen loss: {gen_loss:.7f} \\tdisc loss: {disc_loss:.7f} \\t\'\r\n                                  f\'gen count: {gen_count} \\tdis_count: {dis_count}\')\r\n\r\n                self.update_status(f\'training epoch {epoch}\')\r\n                # self.logger.debug(f\'Epoch: {epoch}\\t time: {etime}\\tDLoss = {d_loss:.4f} GLoss = {g_loss:.4f}\')\r\n                # self.checkpoint.save(file_prefix=self.checkpoint_prefix)\r\n                if epoch > 100:\r\n                    self.save()\r\n        self.logger.debug(f\'Final gen loss: {gen_loss}  disc loss: {disc_loss}\')\r\n        # self.checkpoint.save(file_prefix=self.checkpoint_prefix)\r\n        job.db_job.training_time = int(time.time() - start)  # Round to nearest second\r\n        self.update_status(JobStatus.trained)\r\n        self.save()  # Save the generator and discriminator models\r\n        self._trained = True\r\n        # self.checkpoint.save(file_prefix=self.checkpoint_prefix)\r\n\r\nRun with batch size of 10240 or higher.\r\n\r\n\r\n', b'I think I found the problem. Looking through the TF source, the function CHECK_GT takes int32 as the arguments. For my model, the tensor size for batch of 1024 is [1024,250,250,64] which totals: 4,096,000,000. If I cast that to an int32, the resulting value is -198967296 which is what I see in the console when the program dies: .\\tensorflow/core/util/gpu_launch_config.h:129] Check failed: work_element_count > 0 (-198967296 vs. 0)\r\nSince modern GPUs can handle massive models (my Titan RTX has 24GB), you need to change the int arguments to long in CHECK_GT (and similar functions).', b'This issue has been automatically marked as stale because it has no recent activity. It will be closed if no further activity occurs. Thank you.\n', b'I would like some feedback on my suggestion. I can put together a standalone test case if necessary, but it should be easy to guess that using int32 for the parameter size checks is going to cause problems as models get larger and GPU memory continues to increase. ', b'Adding @rohan100jain from tf.core team for this issue. From the latest message, it might be a int32 overflow issue somewhere in TF.\r\n\r\nIn the meantime, please provide a some reproducible example. Thanks.', b'It is without question an int32 overflow problem. Please look at the function \r\n```\r\ninline GpuLaunchConfig GetGpuLaunchConfig(int work_element_count, const Eigen::GpuDevice& d) \r\n```\r\nin tensorflow/core/util/gpu_launch_config.h.\r\nIt takes an int as an argument. When work_element_count exceeds the system limit for int, the program aborts. You can check by calling it with a work_element_count of value 2200000000 or greater on an int32 system.', b""```\r\nimport tensorflow as tf\r\nfrom tensorflow.keras.layers import Reshape, Dense, BatchNormalization, Flatten, LeakyReLU, UpSampling2D, Conv2D\r\nfrom tensorflow.keras.initializers import he_uniform\r\nimport numpy as np\r\n\r\nnoise_dim = 128\r\ndim = 10\r\nupSamp = 5\r\nfeature_size = 328\r\nbatch_size = 1024\r\nkernel_init = he_uniform()\r\n\r\ninputs = tf.keras.Input(shape=(noise_dim,))\r\ndense = Dense(128 * dim * dim, kernel_initializer=tf.keras.initializers.RandomNormal(stddev=0.02))\r\nx = dense(inputs)\r\nx = BatchNormalization(momentum=0.8)(x)\r\nx = LeakyReLU(0.2)(x)\r\nx = Reshape((dim, dim, 128))(x)\r\nx = UpSampling2D(size=(upSamp, upSamp))(x)\r\nx = Conv2D(64, kernel_size=(5, 5), padding='same', kernel_initializer = kernel_init)(x)\r\nx = BatchNormalization(momentum=0.8)(x)\r\nx = LeakyReLU(0.2)(x)\r\nx = UpSampling2D(size=(upSamp, upSamp))(x)\r\nx = Conv2D(1, kernel_size=(5, 5), padding='same', kernel_initializer = kernel_init)(x)\r\nx = BatchNormalization(momentum=0.8)(x)\r\nx = Flatten()(x)\r\noutputs = Dense(feature_size, activation='tanh', dtype=np.float32)(x)  # All output between -1 and 1\r\n\r\ngenerator = tf.keras.Model(inputs=inputs, outputs=outputs, name='Generator')\r\n\r\nnoise = tf.random.normal([batch_size, noise_dim])\r\n@tf.function()\r\ndef train_step(data):\r\n    with tf.GradientTape() as gen_tape:\r\n        synthetic_data = generator(noise, training=True)\r\ndata = tf.random.normal([batch_size, feature_size])\r\ntrain_step(data)\r\n```"", b""Make sure you run the code above on a GPU with enough memory that you don't get an OOM exception. This code was tested on an NVidia Titan RTX with 24GB of GPU memory."", b'Please let me know if the sample code above reproduced the problem and if it is helpful.']",open,2021-11-24 14:32:58,
https://api.github.com/repos/keras-team/keras/issues/15697,b'Changes a PSS test to use MinSizePartitioner instead of FixedShardsPartitioner to unblock tf.random.Generator rollout.',[],open,2021-11-24 01:08:03,
https://api.github.com/repos/keras-team/keras/issues/15694,b'Categorical Crossentropy Loss.',[],open,2021-11-23 17:54:21,
https://api.github.com/repos/keras-team/keras/issues/15685,b'Update permute.py',"[b'Hey @qlzh727 , thanks for reviewing the PR, I shall make the necessary commits. Thanks', b'Hey @gbaned , please review my comments and suggest me the necessary changes. Thanks', b""Hey @gbaned , please assign me another reviewee, as @qlzh727, hasn't reviewed my PR past 2 days. Thanks"", b""Hi @Bhavay192 ,\r\nThe example given in the documents is an example of permute in 3D tensor. What you saying is about a 4D tensor. Also when I say a rank, the batch is also included. \r\nIf you still can't follow please refer to [this notebook](https://colab.research.google.com/drive/1LcsSibKSVEoU0hHGhnblX9Bp18i7fDEt?usp=sharing)\r\nThank you"", b""@Bhavay192 Can you please check @old-school-kid's comments and keep us posted ? Thanks!""]",open,2021-11-22 09:50:47,
https://api.github.com/repos/keras-team/keras/issues/15680,b'Binary Focal Crossentropy Loss.',[],open,2021-11-19 20:17:15,
